Hotelname,Review,Reviewed By,Date,Rating
Treebo Crystal Studio,It was a pleasant stay there. Good staff with nice service. But rooms are not that calm because I was able to hear the noise coming from outside. And I had to wait even after my check-in time Which is not appreciable.,sanveg1432,2-Apr-18,4
Treebo Crystal Studio,The entry of the hotel is not very attractive. few items mentioned in the breakfast Menu were available. The food items ordered are very expensive and service very delayed. Only Overall very expensive for the facilities and service,Rajesh R,16-Jan-18,3
Treebo Crystal Studio,"Room is spacious and clean. Located at busy road, traffic noise continuously hear inside room. No restaurant and room service. No parking. Not value for money.

Just opposite a good restaurant is there",d_vijai,7-Nov-17,2
Treebo Crystal Studio,"It was a Wonderful experience there. Staffs are really cooperating and manager Sharad there is really cooperative since i had less cash and had paytm balance so he asked me to pay him via paytm and he paid the cash on my behalf..
So people please do visit treebo sakchi jamshedpur once",Nishant_R,25-Oct-17,5
Treebo Crystal Studio,"Treebo crystal studio is a nice place to stay. Situated in Sakchi, at the third floor, the hotel has good rooms, nicely maintained and spacious. The front office is courteous and helpful. The food is also good only problem is that they have a restaurant outside the hotel premises and hence takes time to deliver.",TravellerAnup,21-Oct-17,5
Treebo Crystal Studio,"Centrally located in Jamshedpur's market area. Well appointed comfortable rooms. Room size is good and decor attractive. Flip side is that it does not have any windows. But did not feel suffocated. Overall good value for money. The service is good. They do not have inhouse restaurant, but several restaurants around and hotel will help you to get food. Staff is polite and courteous.",Vivek Ray,20-Feb-17,5
Treebo Hangout Residency,"The hotel rooms are spacious and very clean which I liked the most. They do not have an in-house restaurant but the restaurant on the ground floor serves the purpose. I did not like the approach to the hotel. To sum it up, it is value for money hotel for short stay's.",Shiv2790,5-Apr-18,4
Treebo Hangout Residency,Rooms are spacious and Clean. Staff is very friendly and service was top notch. Location is good if you are looking for a place near Tata Steel. It doesn?t get better than this under 2K in Jamshedpur.,Atul S,24-Jan-18,5
Treebo Hangout Residency,"This hotel and hotel staff is very good .
And hotel is very neat and clean. I am very impressed and i want to stay next time in hotel treebo hangout regidency. We diside in future we stay only in hotel treebo.",Ymanish511,2-Jan-18,5
Treebo Hangout Residency,Room service ia pathetic..Staffs were too lazy when it comes to provide service on time.Rooms are not good at all. Complementary breakfast is just next to horrible.My first visit to Jamshedpur will be remebered because of this hotel,sankhashubhrabww,12-Dec-17,1
Treebo KC Manor,"Me and my wife stayed here for 1 night. The room and the toilet were very clean, linen and towels were also sparkling clean. Restaurant food was refreshing and delicious. Room service was good. I will definitely come back to this hotel and recommend it to all.",ShantanuSamaddar2014,16-Mar-18,5
Treebo KC Manor,Visited KC Manor Treebo for one night. Location is very good. 10 mins from the station and a string of shops on both sides. Initially the room allotted had some smell but they immediately changed the room. We had an early morning checkout so they packed breakfast as it was included in the room. For rate they offered very good stay.,roadtrippingagain,23-Feb-18,3
Treebo KC Manor,"Stayed for 5 nights with my parents. Was a very pleasant stay overall. The room service and response is excellent with very little delay in attending to any requests. The dining and breakfast area is also quite pleasant and breakfast is a worth opt-in since there is nothing much nearby. They have a good enough spread with slight variation every morning. The a-la carte dinner was wonderful too. We had 2 meals and were not disappointed at all. The taste and service were both good.

The only issue we faced was that the drain in the bathroom was not working well. The water kept getting retained on the floor which was super annoying and quite disgusting. Despite making multiple requests, there was no solution to this problem which is totally unacceptable. Please check this aspect before you opt for a room.",SunilSamuel,12-Feb-18,4
Treebo KC Manor,The stay was very comfortable and staffs were also courteous. The rooms very also very nice and spacious the bathroom was fantastic and the connectivity to all places was also good. The overall experience was amazing,namitaa6,21-Mar-18,5
Treebo KC Manor,"Should stay here if in Jamshedpur.
Value worth for the amount paid.Book only online that too in treebo.com.

Other websites and on the spot payment would be expensive",ayushmodi2018,24-Jan-18,5
Treebo KC Manor,The breakfast is very monotonous and definitely needs some variety and freshness. Each room should be provided newspapers early morning. The food menu for rooms also needs some more variety specially in the punjabi section.,pareshkm,27-Dec-17,5
Treebo KC Manor,"Wi-fi service was during my 4 nights stay & as per Treebo Gaurantee we should get a refund of 300/ day.

I informed front desk regarding no Wi-fi.",rajh153,23-Dec-17,4
Treebo KC Manor,I was staying in Room no. 205 then in 405. but in both the room there was wi-fi. I complained many times but didn't get the wi-fi/internet throughout my complete stay. service quality ha to be improved.,sanraut7,20-Dec-17,2
Treebo KC Manor,I stayed at KC Manor Jamshedpur on 7.12.2017. In november I stayed at the same hotel in room No 106. That room was good. This time they offered Room No 107 a room not up to the standard in comparison to room number 106. Asked several times for menu card for ordering food got after long waiting. In washroom the shower didn't lock when switched over to hot water section. So no hot water through shower. Last time I liked the hotel but next time definitely not to be checked in this hotel,AMITABHA67,11-Dec-17,2
Treebo KC Manor,Treebo is good hotel chain all view I am satisfied staff is good Manor halpfull oval all its value for money next time definitely must be try....food quality is good some improvement in breakfast and variety pls improve all done,tripvisiter,29-Nov-17,5
Hotel Rajhans,"Overall experience was OK. Area is good, public transport communication is very good. Services are Ok, staffs are good they help really. Food services are good but a bit costly with respect to the quality of food.",Shamim_kol,13-Jun-16,3
Hotel Rajhans,This is a nice budget hotel in Jamshedpur. Located in Bistupur area . Superb connectivity from that place to roam around the city. It was renovated recently and rooms are spacious and neat and clean. Excellent Wi-Fi facility is available also.,sarojsahoo,25-Feb-16,4
Hotel Rajhans,"this hotel is very old and not renovated since long. Overall it is located within a very prime location like bistupur, the management might not be interested to get benefit of the same. Price-wise is ok. Service are good. small rooms with uncomfortable pillows makes bad sleep all-together. Overall an average option.",kuntalganguly,26-Apr-14,3
Hotel Rajhans,"1. Hotel is situated in posh area (Bistupur)
2. In regard to communication from the Hotel is good in respect to public transport connectivity
3. Room service was good
4. Fooding charges are little bit higher, in consider with overall Hotel rating
5. Room rent is little bit higher, what it suppose to be",tapantapu,9-Sep-13,3
The Altira Hotel,"I had booked this hotel in the last week of January for accommodating the guests for a family function. At first very skeptical about the hotel, the first looks impressed me a lot. From then on each process was very heart warming experience. From booking the rooms, to getting the guests accommodated and their Hospitality. A great value for money hotel in the area which never had any hotel in the near vicinity,

Highly Recommended.

A big kudos and thank you to The ALTIRA Hotel staff.",Suman c,13-May-17,5
The Altira Hotel,Is a nice decent hotel with clean bathroom. The staff is helpful.Although then don't have restaurant in the compound but they serve from there well known old restaurant and the food is good. If u want to visit telco this is the place for u. The hotel is hard to find and the surrounding location is not good. Overall best hotel if u want to be in telco,asish_g,25-Mar-17,5
The Altira Hotel,"Good hotel, bit outskirt from the city, but if you are visiting any of the Tata Offices - then this is the most convenient place to stay. Reception staffing is bit issue but rest is excellent. As of now no restaurants in the hotel & they provide food from their decade old so called Dhaba - which is mouthwatering. KUDOS to all staffs there.",saumen2006,9-Dec-16,4
The Mahal Inn,"This is a pathetic hotel and has abusive staff. I booked this hotel via MMT. The booking was confirmed and payment was made in full. When I arrived at the hotel, they didnot gave me a room saying that the hotel is full. I asked the guy (name is Dev) how this is possible when I have an advanced booking. He said he don't know and asked me to wait and talk to the GM of the hotel. The GM arrived after half an hour and said we cannot give u a room as the hotel is full. I asked him to cancel my booking coz if I cancel my booking then MMT will deduct cancellation charges and he said and I quote ""main ku karoon beh***od, khud kar saale aur bhag ja yahan se koi room nai hai yahan."" I asked him not to use abusive language and speak nicely, and he responeded and I quote ""saale yahin maar dunga beh***od, koi dhoond bhi nahi payega tere ko."" Please do not book this hotel as it threatens your life",sunnypc99,28-Dec-17,1
The Mahal Inn,"Food Quality is Good, Quite Place, Non Veg Items are more popular, Good place celebration marriage ceremony & other parties, Ample space for big ceremony. Approach road is good. Overall good place. One can dine here.",Ash K,25-Jun-17,4
The Mahal Inn,the location is excellent. on the outskirts of the city .the place is good for small and big parties. food is also decent.but could have been better great service.polite support staffs. its good for small hangouts too.,pranay6687,21-Jul-16,4
Motel Madhuban,"Best hotel as per its location, no other competitors near by so far, good food, people having work in and around adityapur, kandra, Gamharia, Jamshedpur this is the ultimate hotel. Rooms are good, adequate parking. Overall Very Good.",Ash K,29-Jun-17,4
Motel Madhuban,"Was there for a wedding and the arrangements for hotel and rooms was just below par. no was there to even see that we have drinking water in the rooms, towels in the bathroom, and even show how to switch on the lights of various bulbs in the room/bathroom. The bed sheets were torn, pillow was just flat and filthy. no mode of communication form the room to any outlets. laundry service was pathetic and charges was huge",NirajkumarSinha,11-Apr-17,1
Motel Madhuban,"The hotel is located on a highway, outside Jamshedpur. 

Rooms were ok, but they are definitely too expensive. A/C works properly, while the bathroom is a bit outdated.

At the time of check-out, although we had booked through an international website, we were asked to pay more than the agreed price.

Waiters and staff used to get into the room without even knocking on the door. 

Not recommended.",Matteo F,25-Mar-16,2
JK Residency,The hotel is near a marketplace and has a good ambiance. The rooms don't have a great view but the bed and the bathrooms are neat and clean. The restaurant is good and gives a good variety of options.,nandishkenia,22-Jan-18,4
JK Residency,"This hotel is good place for business stay. very near to Sakchi market. Food in the restaurant is excellent. but breakfast offered as complimentary is not good. needs improvement.
This hotel rooms are rarely seen in Goibibo but we can directly contact and get the room booked. I am a regular visitor to this hotel and they provide special discount",Priyamohan72,3-Oct-17,4
JK Residency,"This review is only for Appetite, of JK Residency.

The Food is great and so is the ambiance. Seating arrangements is also quite well planned and appreciative. However, its the service that has disappointed me almost everytime I have been there.

Last time I went there, our waiter goofed up with our order. Part order came, part didn't. Even they were not well informed with the drinks offer that was going on. Needless to say, even the manager didn't agree with the ignorance of the waiter. We had to strongly put our case for them to take a note of it.

Such service is not appreciable from a restaurant who boasts of such stature. Rest all, as I mentioned earlier, regarding the food and all was very appreciable.",Samayak M,3-Jun-17,3
JK Residency,I mostly prefer staying at this hotel during my trips to the city. Location wise it's very approachable and provides a comfortable stay with good food. Only negative point I found is that they don't have all English channel's subscription for their TV.,Mudit M,20-Nov-16,4
Ginger Hotel Jamshedpur,I am on business trip to jamshedpur and I stayed in ginger hotel. The hotel is very neat and clean and all the staff is very co operative. Specially keshav is very a freindly person and supportive. I will stay in ginger only,nikunj c,7-Apr-18,4
Ginger Hotel Jamshedpur,Well budgeted neat and clean hotel. Hotel staff are very kind and polite. Specially Mr. Keshav is a nice guy. Food is also good. Nearer to Railway Station and center of the city. Easy excess to biggest mall.,anand p,7-Apr-18,4
Ginger Hotel Jamshedpur,Hotel is very neat n clean. All staff members are very co operatives. Mr. Keshav dey has gave us very good service during dinner. Very soft n kind person.also all managers are very co operatives. Thanks to all.,jay p,7-Apr-18,4
Ginger Hotel Jamshedpur,"FO team Alveer, Rumana, Debsankar Khanda and Sanit from F&B are very friendly and curtious . Cleanliness, Service, everything is good one of the recommended Hotel in Tata Nagar access to railway Station is good",Goutham K,6-Apr-18,5
Ginger Hotel Jamshedpur,"Stay was very good and pleasant, being a Hotelier I am aware of each and every operation in the industry namely FO team Alveer, Rumana, Debsankar Khanda and Sanit from F&B are very friendly and curtious . should take care of Wi-fi speed is not up to the mark though it?s a family trip fine but for a business trip they need to work on it . Breakfast is good and room service needs improvement on the food delivery",Imerasparesort,6-Apr-18,5
Ginger Hotel Jamshedpur,Room service and room cleaning is very good.all time is good service . Specially housekeeping staff mr Deepak das.testy food and ginger hotel jamshedpur all staff is good . Regular I am staying in this hotel .And my second home in ginger hotel.,manoj d,5-Apr-18,5
Ginger Hotel Jamshedpur,Regular I am staying in this hotel. DŠepak Das had good experience in housekeeping and cleaning. He was very helpful and time pantuation while cleaning the room. Ginger hotel prime location of jamshedpur and have easy connectevity to all part of city. I really like the room cleaneness of the hotel. And all the staff were good and halfful.,Prabha G,5-Apr-18,5
Ginger Hotel Jamshedpur,"I can't help myself from falling in love with everything in this hotel.There isn't single negative-point that I could say about Ginger Hotel @ Jamshedpur.



I liked everyone in Ginger Hotel @ Jamshedpur.  

One of the greatest gifts you can give to anyone is the gift of attention. 

I had a chance to meet with Dipankar, who is working as a wait-stuff. His is attentive, fast, pleasant, unobtrusive. My wife don't like spicy food. With the help of Dipankar and his chef, my wife was able to eat all different kinds of food @ Ginger. And I must confess, Ginger's chef is one of the best chef in Jamshedpur. As they are capable to prepare tasty & delicious food, even-though it wasn't too spicy. I would like to say thanks and appreciate to Dipankar!!! Keep it up!!!


Everyone at Ginger hotel were so good, helpful, friendly, humble and laborious. If I need to stay @ Jamshedpur, then I will stay in Ginger. I would like to appreciate Surbhi and Rumana for their effort and good work.",abhi8812,2-Apr-18,5
Ginger Hotel Jamshedpur,"Appreciate Mr. Keshab for his excellent service during my entire stay at GHJ for a week in the month of April.

Nice communication with prompt service assistance.

Keep it up.

Thanks and regards,

Anant Shaligram.

9730032352.",854anants,2-Apr-18,5
Ginger Hotel Jamshedpur,"Keshab dey is very good in services and he is very soft spoken hard working guy.
Hospitality was great. My room no. 122.
Hotel ambience is great with open spaces.
I highly recommend this hotel for visitors",Vishvaraj S,27-Mar-18,5
Ginger Hotel Jamshedpur,"Not as great as expected wrt food
Rooms were decent and not much if issue with respect to Wi-Fi and other faculties however the food taste did not meet our expectations at all. Chicken was not well cooked. Dishes were not at all tasty.",Ravi A,24-Mar-18,4
Ginger Hotel Jamshedpur,"Had pleasant stay at Ginger.. Restaurant provides delicious and tasty food for breakfast.. whenever I go to Restaurant, Mr. Dipankar always comes in front with a smile and warm greetings.. he is very soft spoken and polite.. active and respond immediately.

Had great stay in Jamshedpur.",Venu B,24-Mar-18,5
Ginger Hotel Jamshedpur,"Hotel is good location for railway station & good house keeping. Staff is co-operating. Debsankar and saikat from reception is very co-operative person, Subrat for house keeping is very polite. I will recommend my office staff & friends.",Kamala E,24-Mar-18,5
Ginger Hotel Jamshedpur,Excellent room condition with best services. Specially room cleaning mr deepak das very professional. FOOD WAS VERY GOOD. GINGER HOTEL JAMSHEDPUR ALL STAFF ARE ALL TIME AWESOME SERVICE . Specially thanks for mr deepak das all time are good service. And thanks to all ginger staff,nitish singh r,24-Mar-18,5
Ginger Hotel Jamshedpur,"Regularly I am staying in this hotel, During my planned business visit to TATA STEEL,
i consider it an excellent hotel with good hygienic and discipline staff, Restaurant found to good with delicious food",sureshsblr34,24-Mar-18,5
Ginger Hotel Jamshedpur,ts a very nice place to stay. It has all the facilities you desire for in this price range. All the staffs are very cooperative. Main highlight is the hygiene and cleanliness of the rooms and bathrooms,Vidhu S,17-Mar-18,5
Ginger Hotel Jamshedpur,I have stayed on this hotel 05 th March till 08th March and i have found this hotel is very good Housekeeping staff are very good good city good people Beautiful city I am special thanks to Front Office staff Mr Saikat Sarkar he is very helpful and very energetic staff,Harendra S,17-Mar-18,5
Ginger Hotel Jamshedpur,Ginger room cleaning excellent by Mr Deepak das.food was very good. my 1 st time stay in ginger hotel .All time is very good services.front office service is good .Ginger hotel Jamshedpur all staff are good .,Ketan M,17-Mar-18,5
Ginger Hotel Jamshedpur,Ginger hotel Jamshedpur is very good hotel .all staff are very good nature are very good.specially ginger staff Deepak das and Ajit Singh are very good room cleaning. Food is excellent .and thanks to all ginger staff,Vijay J,17-Mar-18,5
Ginger Hotel Jamshedpur,"Ginger hotel, Jamshedpur lives up to the expectations one has of a Ginger hotel as a super business stay destination. It offers almost all the amenities and facilities one looks for, and some are available on asking or sharing (such as newspaper in the lobby, iron board on each floor). But the comfort, cleanliness and service are excellent. Modest breakfast and dinner layout, but considering the buffet charge (breakfast comes free with the room), it's certainly good enough. Service either in the dining room or in-room is fast and efficient. Wi-fi is very fast.",akg_9,17-Mar-18,4
Ginger Hotel Jamshedpur,"I am staying in this hotel for the last 5 months. Entire support staff is amazing and very humble. Kind of attire this hotel provides has ensured me not missing my family, and enabled me to focus on my official work.

Especially Sujay, Deepankar, Amrik has been exceptionally responsive.

Maintenance staff has always been very quick.

If you are in Jamshedpur, this is the hotel that you need to choose",pop r,10-Mar-18,5
Ginger Hotel Jamshedpur,"People are so polite and responsible, took very care.. Especially the room service boy called sujoy, very honest and humble.

Near to work and located in prime location of Jamshedpur , you can found shopping malls and site seeing near by.",A TripAdvisor Member,10-Mar-18,5
Ginger Hotel Jamshedpur,"1st time in Ginger Hotels and and it has given me an awesome experience. They say the 1st impression is the last impression. The Front Office Executives viz Amrik, Rumana and Surbhi, i will call them the face of Ginger Jamshedpur with good communication and approach. God Bless you guys and i will surely reccomend my family and friends to come here always. The support staff good too no doubt. All the best.",mihir s,3-Mar-18,5
Ginger Hotel Jamshedpur,"We had an excellent stay in Ginger, we arrived at the train station, and were pleased to know the hotel was only a few shorts blocks away. Nice, helpful and friendly staff, good restaurant, good morning buffet. Would again return for a stay at this hotel. Special thanks to prabanjan at front desk.",RiteshR7R,10-Mar-18,5
Ginger Hotel Jamshedpur,"We went for the founders day (Tata) and stayed at this hotel.
its very clean and well maintained. staff is amazingly efficient right from the check in
mr prabanjan was helpful.
in house restaurant is good for lunch/dinner . their breakfast isnt all that good very oily food. no booze (carry your own and have in the room)",bond2015,10-Mar-18,5
Chandra Hotel,"We were on a road trip and stopped here for an overnight stay. It was pretty late when we checked in. Thankfully, they had a room available. It was very neat and clean and the air conditioner worked just fine. The washroom was clean and well stocked with soaps and shampoos. we didn't need anything more for our short stay.",smartaleck_aj,28-Sep-17,4
Chandra Hotel,"It is an average hotel on the outskirts of jamshedpur city. The staff here are very nice people. The rooms are kinda cheap, but the amenities in the room are not completely upto date. I mean, it's clean and all, but the place had n old fashioned tv and our washroom's geyser seemed old.

Overall, its a nice place to stay if you are travelling on a budget.",akj0700,31-Mar-17,4
Chandra Hotel,We had a adventure course on the outskirts of Jamshedpur and we had a day to kill and we friends decided to spend the night here. The rooms were properly maintained and good enough for a budget stay. A little away from the city but it is peaceful at the night. Recommended,Rohitflies,29-Mar-17,3
The Weekend,"A beautiful place to spend two nights . Homely atmosphere, spic n span rooms and toilets which we all require during travel to anywhere. Toileteries in the room simply awesome in the price tag. People are courteous . Only five cottages but that is my point oif view is absolutely O.K.More people , off course more business but more noise too. The authority is very choosy about the occupants and they do not allow generally young people or young couple . That is good or bad is different issue but acceptable to me. As this place is in the amidst of nature so to maintain the serenity is important. One point I did inform to the host that breakfast with sandwich is not that good in terms of quantity . They told me that whether I did ask for more or not. Yes none of us did ask for sure but at the same time it could have been asked from the part of the owner. As a result , on the departure date we wanted to know that Puri /Sabji can be had if requires . They politely said 'Yes"".If not then we were ready to pay more for extra. This is not a complaint but little professionalism could have been more enjoyable. At last , a great stay",Somnanth B,21-Aug-17,4
The Weekend,"This place is well situated away from the city, surrounded by natural beauty from all sides. Lush greenery is maintained inside the resort. The resort boasts of a small pond, where fishing can be done, but on prior request, but on a catch and release basis.
They also carry out farming of vegetables in their garden space. Apart from the cozy cottages, there are many spots to just laze about and enjoy nature. 
The food served by the staff is very delicious. Must try is the 'desi chicken'. The host and staff are very friendly, but have a set of norms for their visitors, which is very appreciable. This place is only meant for families, as maintained by the host. 
Also, for a bird-watcher like me, one would find plenty of winged species flying in and around the resort",Samayak M,11-Jul-17,5
