Hotelname,Review,Reviewed By,Date,Rating
The Weekend,"We went to The Weekend Resort last weekend and in one word the stay at this resort was awesome.The resort is exceptionally well maintained.There are 5 AC cottages and the rooms are also very well maintained with LED TV in the room (though we didn't turn it on :) ) and geyser in the bathroom.They provide wide range of toiletries.

In this resort they do organic farming and if you walk around the resort you'll get to see plenty of vegetables, fruits and flowers.Whatever food (except fish/chicken) we ordered it was picked from the garden and then cooked.The taste of the food was awesome.

If you have kids along with you, they will enjoy the place like anything.

This is such a peaceful place that it will surely rejuvenate your mind.There are few places which you can go explore from here. 3 kilometers away there is a place called Paharbhanga which can be explored in early morning.Its better to avoid this place after 10 am as it gets hot.One can also go to Dimna lake and Jubilee park in Tatanagar which is around 22-25 kms.The hotel people advised us not to go to Dimna lake after sunset and we abided by it.They were very helpful and showed great hospitality.

If you are a drinker you need to carry your booze.You will not find anything outside this resort.You can also order Mahua and their staff will bring it for you.

I would also like to do a special mention of their staff ""Gobindo"" who was very nice.This guy does his work happily and will always ensure that you are comfortable and enjoying every bit of your stay in this resort without any trouble.

The only negative thing that i found was that few food items (like Duck,Mutton) were a bit expensive.",Sandipta P,8-Mar-17,4
The Weekend,"We went to The Weekend Resort last weekend and in one word the stay at this resort was awesome.The resort is exceptionally well maintained.There are 5 AC cottages and the rooms are also very well maintained with LED TV in the room (though we didn't turn it on :) ) and geyser in the bathroom.They provide wide range of toiletries.

In this resort they do organic farming and if you walk around the resort you'll get to see plenty of vegetables, fruits and flowers.Whatever food (except fish/chicken) we ordered it was picked from the garden and then cooked.The taste of the food was awesome.

If you have kids along with you, they will enjoy the place like anything.

This is such a peaceful place that it will surely rejuvenate your mind.There are few places which you can go explore from here. 3 kilometers away there is a place called Paharbhanga which can be explored in early morning.Its better to avoid this place after 10 am as it gets hot.One can also go to Dimna lake and Jubilee park in Tatanagar which is around 22-25 kms.The hotel people advised us not to go to Dimna lake after sunset and we abided by it.They were very helpful and showed great hospitality.

If you are a drinker you need to carry your booze.You will not find anything outside this resort.You can also order Mahua and their staff will bring it for you.

I would also like to do a special mention of their staff ""Gobindo"" who was very nice.This guy does his work happily and will always ensure that you are comfortable and enjoying every bit of your stay in this resort without any trouble.

The only negative thing that i found was that few food items (like Duck,Mutton) were a bit expensive.",Arindam G,8-Mar-17,5
Hotel Darshan,"Good hotel .. you can ask for Dalkhichuri + some fry ....they will preparte for your... Good food, well connected .. staff are good .I have staying at this hotel most of the time I visit Jamshedpur. It's a very decent place to stay",goanup,14-Nov-17,3
Hotel Darshan,"I used to visit Jamshedpur frequently due to Company Business.This is the first time I stayed in this hotel. No doubt hotel is in good location of Bistupur, as communication is readily available. To be true Hotel has number of different kinds of Rooms of different budget & value to money as compared to other hotels in the city. Some rooms are small in size but it is better to check & compare before you check in, as good option is also available depending on budget. I noticed a good complimentary breakfast but less choices.Food quality is good. Wi-fi is fast. Though it is a budget hotel I will rate above average due to its location & hospitality, & I will love to visit again",Chandrasekhar P,11-Sep-17,3
Hotel Darshan,"I have staying at this hotel most of the time I visit Jamshedpur.
It's a very decent place to stay. The rooms are bit cozy, but the service and the food is excellent.
They provide bed tea at even 06.00 am. 
Buffey breakfast is good enough.

For a budget stay, this hotel is one of the best",Santanu_1234,12-May-17,4
Hotel Darshan,"Located in main market of Jamshedpur and 3 kms away from railway station, this is pretty average hotel which requires renovation. Some rooms are ok but few are below average. The room in which I stayed didn't have the door locking knob in toilet. Reception is good though.",kgt7,22-Mar-17,2
Hotel Darshan,"Stayed here twice in the last two months. Traveled on business on both occassions. Darshan is Brilliant hotel with excellent cleanliness and spacious rooms. Very economical for business travelers. Room service and restaurant serve good quality food.Breakfast is complimentary for business guests. Ambience, Service and humble staff. Overall very impressed with both staff and amenities at this hotel. Strongly recommend for business travelers traveling or visiting Jamshedpur.",Karthik M,16-Dec-16,5
Hotel Darshan,"Easily accessible 
In bishtupur opposite ram mandir
Rooms are clear but very small after keeping our stuff there is no space to move. 
Good Wi-fi 
Fr food hotel is having a restaurant where they serve only veg food and fr non veg u can order it yr room.",Sudeshna M,7-Jul-16,4
Hotel Darshan,Very clean and calm hotel enjoy your food with piece. Food quality is good price is not expensive.The staff behavior is excellent. Only demerit is food processing time is above normal u have to wait a while they serve you your order. But that's ok when you are sitting with friends time factor is not so much. Overall experience is good like to dine again and again.,Amresh_traveller,25-Jan-16,4
Hotel Darshan,Located in the heart of Jamshedpur. Easy access to almost all places in JSR. Rooms were fairly decent and the staff were very accomodating. Room service food was average and they provide complementary breakfast wven if u stay in a non-air conditioned room .Value for your money.,Ganesh K,9-Apr-16,4
Yellow Tree,"The place is wrongly called a hotel whereas it is more like a guest house. The rooms are spacious and comfortable but does not have much to offer in menu. They do have a kitchen but it seems to function only for breakfast. Usually all food is brought from an adjoining restaurant, which is horrible. ",Neeraj S,3-Jan-18,3
Yellow Tree,Poor service ...... charged 4000 rs for basic room... not having proper toiletries... gyser was not working prpoerly... its a hotel made in apartment... dinning options are limited..food quality is good... lift not working... no bell boy carried luggage to 2nd floor. One can easili find better ones at jamshedpur at this cost.,Maniis a,27-Dec-17,1
Yellow Tree,"It's designer hotel, good interior, awesome looks, bit costly, it's a romantic place, food is not available, one can just stay for beautiful experience, Nice place. Overall good. ARRANGEMENT OF FULL TIME FOOD AVAILABILITY IS REQD",Ash K,20-Jul-17,4
Yellow Tree,"Very clean rooms the room sizes are also big. Great Service by the staff. Though they don't have a full fledged kitchen, still they are able to serve great food from the restaurant next door. Felt like home.",chaitany a,17-May-17,5
Yellow Tree,"I had an opportunity to visit Jamshedpur for a official visit however got my self booked at this hotel which is located in a building and transformed the apartments into hotel rooms and it""s a family managed apartment/guest house which offers friendly service however this place does not have their own proper kitchen at all and offers limited variety of breakfast in their small pantry however the rooms are elegantly designed and offers descent service however they are dozens of better hotels in Jamshedpur than this for the price that they charge overall no big complains but certainly not worth more than rupees 2000 if they charge more than pls look for other suitable options which is not a challenge in a city like Jamshedpur.",manish_mehta,23-Dec-16,3
Yellow Tree,"I booked with a reference and after talking to Mr prashant I was assured of room after reaching late and without prior payment.
I was upgraded to suite rooms.
Rooms were very nicely done above star class.
Reception and staff are always at service with smile.
Swift check in swift late check out.
We had a in house meeting with outside guests but they were pleasently attended.
I m very happy with their effort and 3 days stay at jamshedpur.
I strongly recommend yellow tree.

Brkfast can be improved !
Whereas Sunday morning complementary Brkfast at adjacent restaurant was awsm.
Best wishes.
Value for money paid.",Dr Biswajit P,31-Jul-16,5
Hotel All Seasons,it is a good returent. you can go here with family . veg and non veg meals are avilable.the costa are also regenable. you can take lunch and dinner both.few good staters also avilble.you can visit onace.,ahaldar,17-Dec-16,4
BS Plaza,"Hotel B S PLAZA located in the Bistupur area is a good property. I stayed in last November for one night stay. The rooms are large. There is a roof top restaurant. The breakfast was complimentary and was of good Quality. The hotel tariff is also reasonable.

Would recommend to colleagues and friends for the next official tour in Jamshedpur.",tty70,29-Jan-18,4
BS Plaza,The Hotel is reasonably comfortable for a business traveller and offers complimentary breakfast which has a reasonable spread. It is centrally located and accessibility is not an issue. The only issue is that the glass panes are not sound proof and hence you may have to bear with the traffic noise in the morning.,GVBOSS,1-Dec-17,4
BS Plaza,"Have stayed here about 2 years ago, the place was much clean, staff was much courteous, hospitality was very good. Most importantly cleanliness was much better. But in last visit felt perhaps mangement has been changed etc, as hospitality have reduced, overall breakfast quality is pathetic.
They definitely need to work around the same, it was one of good budget luxury places in Jamshedpur, it has been reduced to mere Mediocre place",shs07,17-Aug-17,3
BS Plaza,The hotel is located on the main road and very near to the market so don't expect a view from the window. You will be greeted to smoking chimney and coal dumps. There is a dirty smell in the corridor and lobby and I found the stay very depressing. The TV does not work half the time and good luck finding any decent channel. The breakfast is half decent and unappealing (don't know if it was the smell). The toilet was clean but a little cramped. Overall I wouldn't think of staying there next time.,amandeep118,7-Aug-17,1
BS Plaza,"Good HOTEL Good Food good service what you want more. Only they don't have arrange for you driver . Room is good , Food is little expensive but taste is good . Break fast is nice and sufficient. Good staying",bibek113,26-Feb-17,4
BS Plaza,"Rooms are very normal and small. You will get such rooms at half this price. Food is highly expensive and quantity very less. Stay here only if you don't have any other option. Sometimes they keep buffet, sometimes they don't. Very average breakfast.",Manas P,27-Nov-16,1
BS Plaza,"Booked using TripAdvisor app through travelguru. Prices were approx 400 rs more. Don't know whom to blame but coming to the Hotel, it was good. Staff were excellent, very accommodative. Food was good but could have been cheaper",pranay6687,27-Nov-16,4
BS Plaza,excellent location as it is in center of city. rooms are decent. the price seemed a bit high bt that's ok. hotel services are good. 1st floor rooms are best. banquet hall is a bit small bt ok for small parties.,adirups,28-Aug-16,3
BS Plaza,A budget hotel on the Busy Bistupur main road. Rooms are small and smelly. Service is ok. Food is average. Suitable only for 1-2 days stay on buisness trip. on Busy commercial street and easily accessible,aveejar,21-Jan-16,3
BS Plaza,"I have been visiting this hotel from last 3 years. I have stayed at this hotel and have ordered food from the in house restaurant. I admire the friendly hotel staff, starting from the reception to kitchen. The courtesy and the friendliness of all the hotel employees has always touched me. Tandoori Chicken is the my favorite. The rooms are moderate; however, the service is very much comfortable and appreciable. Well located in Bistupur with almost all kind of required services. Laundry service is very much limited and hence i would advise to check the timings for the same. Overall, It was a memorable experience since the very first time.",adirups,24-Mar-16,5
BS Plaza,"I have stayed twice at BS park plaza and visited couple of occasions for lunch or dinner parties. At bistupur, the main market place of jamshedpur. Always delighted with the services and food. Parking space is not enough, however in my view that is not a constraint. You may visit here for wining and dining. Highly recommended",raj74,5-Oct-17,5
BS Plaza,"Jamshedpur has very few mid range hotels. They are too costly as the tax itself is 20 % of the room rent. apart from this hotel,there is Natraj and Bouleward hotel . Both of them don?t have elevators. So we had no choice but to book this one. They took the booking over the phone. No advance payment was required. the location is perfect. The rooms are nice, spacious, neat and clean. There is a geyser fitted to the bath. So no worries about round the clock hot water supply. Our geyser did not function properly on the 2nd day. They rectified it immediately. Breakfast was good. The problems we faced during our stay are.: 1.We had hired an extra bed (Rs 800+).they just dropped a mattress on the freezing cold floor.Thats it!. they did not have the portable cot. They don?t offer complimentary breakfast for children. its not included in this extra bed charge also.
2. the lobby was terribly smelly.
3. doors were jammed.the handle came with our hand.
4. its on the main road- around 2.00 am there was some lorry that was kept in reverse gear (for more than 30min). The loud beep noise was so annoying. I couldn?t sleep anymore.",travelsome4,28-Jan-16,3
Nalanda Hotel,"Although it is quite an old Hotel it has lost its charm in face of new competitors. What I did not like was that they gave me a standard room and while checking out they were billing me a deluxe room. When I brought it to their notice that I was in the standard room , they change the bill. Never expect a good hotel to do this kind of herapheri.",sandipkumarde,22-Dec-17,3
Nalanda Hotel,"This is hotel is not very new and carries a pretty good brand value. Its located in the Bishtupur area of Tatanagar, which is the main market here. Its on the road itself and 3 kms away from Jamshedpur railway station. Very good reception and service. Even they will deliver the complimentary breakfast on your bed once requested.",kgt7,22-Mar-17,4
Nalanda Hotel,"Hotel is located at Bistupur. Location is excellent. I stayed in single occupancy Ac room @ Rs 1800 . You can get discount at reception. Luxury room @ 2800 for twin sharing. Staffs are courteous. Luxary room are good. Infrastructure looks old but maintained properly. Toilet & bed sheets were clean. They will provide shampoo pouch & soap.
Food are ok through it is bit costly. Average cost for veg dinner will be around Rs 300. If you are planning to catch a train in the morning ,better to settle payment after dinner else it will take 10-15 min. Auto`s are easily available in front of hotel. Settle Auto is also available. Distance from hotel to Tatanagar station is around 3 km & auto will charge Rs 60-80.",anjy37,22-Feb-16,4
Nalanda Hotel,Stayed there just for a day. Experience was good. Courteous and helpful room service. Reception desk has also got prompt action. For longer stay the top class rooms are excellent except the location of bathrooms.,SaswatSaraph,10-Dec-12,4
Golden Leaf Resort,"We were a team of 18 people, including 5 kids, travelling from Kolkata and had booked for 2 nights at the Golden Leaf Resort during Holi. We reached Jamshedpur early in the morning around 4:00 AM and the resort manager was helpful enough to allow for an early-checkin. The deluxe rooms were very good - clean and spacious with attached balcony. Room service was very efficient. 
Breakfast was complimentary and served in the restaurant- The Woods. Normally, there was bread, eggs, puri sabji, cornflakes, idli/alu paratha, juices, tea/coffee available for breakfast. 
The resort had a nice lawn which was decorated during the Holi day. Our team had a good time playing with colors. There was also a small children park to keep the kids busy. Special lunch thali @499 was served on the Holi afternoon in the lawn. The taste of the items was good but the quantity was very little. In the evening, we had starters specially the Pahari chicken which was too good. Food was tasty but expensive. The service was good though, we were served ice creams even though we ordered them pretty late at night.

Overall a well-maintained resort, to enjoy a couple of days in the lap of nature.",Tamalika M,17-Mar-18,4
Golden Leaf Resort,"Nestled in the lush green foothills of Dalma Wildlife Sanctuary, this is a perfect weekend getaway resort. It takes approx 4 hours to reach Jamshedpur by train from Kolkata. From station the resort is almost 18 kms away at the fringe of Jamshedpur city. You get close touch with nature yet the convenience of a city. The resort is very well planned. The staff are courteous and food is great. The service quality though good is a bit slow. However if you plan to just laze away your weekend in Nature's lap after a hectic life in city, this is as good as it gets. Tip: Book through online portals who give heavy discounts which even direct booking at hotel cannot match. Do homework before hand.",sk532,5-Oct-17,4
Golden Leaf Resort,"One of the finest and classiest hotels in Jamshedpur. Located outskirts of the town but very near to Dalma Wildlife Sanctuary.

The best part is waKing up in the morning to the beauty of Dalma Hill Range. 

It's a premium hotel (expensive) but every penny spent is worth it",jitendra d,1-Oct-17,4
Golden Leaf Resort,"We had booked for two nights, and had plans of travelling with parents. The pictures seemed nice, and even though some reviews here warns you of shoddy customer service, we thought of taking a chance. Well, after booking through booking.com I tried calling the mobile number multiple times, but no one picks up the phone! Then I called the landline number (you can find it in justdial). Well, someone picks up if you are really persistent (say after every 5th or 6th attempt). But till date they just couldn't confirm our booking. Every time we called they said they will call back, which they don't, and then when you call them, the response is again the same. 
I shudder to think the service we would get during the stay if they can't confirm the booking for the last 10 days. It would be too much of a risk if they turned us down when we land there with our parents! So we went ahead and booked another hotel (KC manor) who was able to confirm the booking the very first time I called. 
Thank God, for free cancellation policies!! Small mercies!",Sayani_Wanderlust,9-Sep-17,1
Golden Leaf Resort,"I was there to attend a celebration party, approach road is very bad and muddy, for big events no proper parking facilities, I was bound to park my car 500 meters away from venue. Good for 50-100 people. Need improvements.",Ash k,5-Jul-17,3
Holidei Inn,I had stay one day .feeling awasom ..really very good hotel .it was my first visit in holideiinn ..room are very clean and well maintained..service was good and food was delicious...every thing is fine ..,bhaskarkumar364,24-Mar-18,5
Holidei Inn,"We have reached Holidei Inn hotel on 8July 2017 , we ahve booked 5 rooms. Hotel is in main Bazar. all the rooms are very good with good AC. Their room service also good. Only one bad thing We had to wait for 1.5 hour to check in on those rooms as they usually takes long time to prepare the rooms for guest chicken. other than that they provide good services. Their food is very good feel like homely food. not very much spicy . They can provide complementary breakfast on the rooms. They don't have big restaurant, but small area wit dining tables which is enough for 10-12 people to sit and take food.",Pritam G,19-Sep-17,5
Holidei Inn,"Nice hotel in Jamshedpur near to Sakchi market easy to reach hotel. I stayed in hotel. the room was good clean and well maintained satffs behaviour was good.room service was good and very quick. breakfast was also good basically ALU pratha was very tasty I had eaten, overall the hotel is excellent. I like the hotel and again visit to my next trip....",Vivek K,8-Jul-17,5
Holidei Inn,"Clean hotel, good food quality, good room service location near sukchi bazar opposite lane approx 200M from Sakchi Gurudwara over Kalimati road. Auto available for all direction Bustand is approx 1Km away",debasis82,17-Jun-17,4
Holidei Inn,Experience wasn't good. Spend a sleepless night there because there was worms or something like this in the bed which causes irritation in my skin. Furniture was quite old. Bathroom might no attract You. Only thing was good was stuffs service.,blackfury60,28-May-17,3
Holidei Inn,"Good Hotel, AC room...Average decor, LCD TV , Hot and cold water available, Quality of food is very good............but overpriced(Rice 100, Alu Bhaji 100 etc)free Wi-fi available.............very near to Sakchi Golchakkar, Location is very good.staffs are good, well behaved",san007dip,11-Jan-17,3
Holidei Inn,Rooms are well cleaned and maintained. Location is very nicely approachable. Staff are well mannered and courteous. I enjoyed my stay here. Room service is fast and excellent. Enjoyed five star facilities at a three star budget hotel which is highly appreciable,sk532,15-Mar-17,5
Holidei Inn,I had stay one day .feeling awasom ..really very good hotel .it was my first visit in holideiinn ..room are very clean and well maintained..service was good and food was delicious...every thing is fine ?,bhaskarkumar364,25-Mar-18,5
Holidei Inn,"We have reached Holidei Inn hotel on 8July 2017 , we ahve booked 5 rooms. Hotel is in main Bazar. all the rooms are very good with good AC. Their room service also good. Only one bad thing We had to wait for 1.5 hour to check in on those rooms as they usually takes long time to prepare the rooms for guest chicken. other than that they provide good services. Their food is very good feel like homely food. not very much spicy . They can provide complementary breakfast on the rooms. They don't have big restaurant, but small area wit dining tables which is enough for 10-12 people to sit and take food.",Pritam G,19-Sep-17,5
Holidei Inn,"Nice hotel in Jamshedpur near to Sakchi market easy to reach hotel. I stayed in hotel. the room was good clean and well maintained satffs behaviour was good.room service was good and very quick. breakfast was also good basically ALU pratha was very tasty I had eaten, overall the hotel is excellent. I like the hotel and again visit to my next trip....",Vivek K,8-Jul-17,5
Holidei Inn,"Clean hotel, good food quality, good room service location near sukchi bazar opposite lane approx 200M from Sakchi Gurudwara over Kalimati road. Auto available for all direction Bustand is approx 1Km away",debasis82 ,17-Jun-17,4
Akash Guest House,"We were here for for short time, only for some hours. The place was not very big. Rate was not very expensive. Room was not big in size. Not very much appealing place to stay. Connectivity wise it is rood. So called reception",garhwaliya,31-Jul-17,3
Hotel BS Residency,"Rooms are big, Lights are good, staff behavior is OK, location is in bistupur but you have to walk around 500 to 750 m for public transport and main market however some daily needs can be found near by. Entrance is good but a near by cows shed will irritate you with its smell.",Amresh_traveller,25-May-16,3
Hotel BS Residency,"Hotel BS residency is an average property in Jamshedpur.Although the rooms are big,they are ill maintained.Poor interiors,broken windows & fittings in toilets & poor quality bed & mattress makes it way below the average hotel.Although known as Corporate Budget Hotel,its not upto the mark.
Restaurant has very few dishes.Service is late & a wake up call request in the morning is completely forgotten.
The only plus point is the staff's courteous behaviour.
Location wise it is in the interior of Bistupur, & difficult to access the main Bistupur market.
A wedding party in the hotel during my stay went on till early morning with loud music & guests depriving business guests of their much sought rest!!",Deepak_01,17-Dec-14,3
Hotel South Park,Spent 3 days here for Company Business. Breakfast is very nice though not wide selection.Regarding stay I would say not so big room but very neat & clean & bed quality is good. Bathroom is also neat & clean. A.C is new & good. Hotel staffs are caring.Plus point is that exactly in center of Bistupur area so regarding communication & local restaurants having wide choices. I would like to stay again & again.,Chandrasekhar P,21-Aug-17,3
