Hotelname,Review,Reviewed By,Date,Rating
Ramada Jamshedpur,Its all staff and their approach which makes things different. I found the same for this hotel. Staff is helpful and ready to help always. I stayed for 3 nights and I had comfortable stay. they serve good continental food and Chinese food is also very good.,sanjeeiv,27-Mar-18,5
Ramada Jamshedpur,I had very comfortable stay there at Ramada. Hotel room was spacious and beds was comfortable. Wi-Fi was fast and speed was good as I had to attend some online concall for my other site and it went off well and smoothly. Buffet spread was decent and food was delicious. Hotel staff is good and smiling. recommend this hotel for business traveller.,A TripAdvisor Member,13-Mar-18,5
Ramada Jamshedpur,I had very comfortable stay there at Ramada. Hotel room was spacious and beds was comfortable. Wi-Fi was fast and speed was good as I had to attend some online concall for my other site and it went off well and smoothly. Buffet spread was decent and food was delicious. Hotel staff is good and smiling. recommend this hotel for business traveller.,Afeej,3-Mar-18,4
Ramada Jamshedpur, I found this hotel to be the best hotel in Jamshedpur city. Checkin was fast and front office staff was courteous. Rooms were spacious and Buffet breakfast and dinner spread was good. I liked their mutton briyani a lot.,Depak G,3-Mar-18,5
Ramada Jamshedpur,Yesterday I have a business dinner in this hotel . This is one of thegood category hotel in Jamshedpur . Located in side the city only . But spreads are not much as we expected . But tasty food . Liquor also served on the table,Lalumanji,3-Mar-18,4
Ramada Jamshedpur,Thanks a lot to Vishal and team to make my stay so wonderful.food was awesome and service was great.will love to come back to this peoperty.not expected such a service in jsr.Special thanks to Malay in front office,mak p,26-Feb-18,5
Ramada Jamshedpur,"Excellent property in the middle of a busy area in Jamshedpur. The room was very very comfortable, particularly the bed. Was well stocked with amenities to make tea/coffee and the room service staff was also very responsive and quick. The breakfast buffet was to die for!!Even the staff at restaurants were well behaved and smiling..... Excellent variety and taste. Overall I highly recommend this property to everyone",Divyasree N,26-Feb-18,5
Ramada Jamshedpur,The hospitality shown by the support staff & managers was commendable. Highly recommended to all people of Jamshedpur & nearby area. The amenities are really good & tidy. The food quality was appreciated by ever guest. The overall experience was AWESOME,Ishaan M,26-Feb-18,5
Ramada Jamshedpur,Very nice hotel. Marriage was a grand success. Hotel staff did a great job. Staff is very co-operative. Great food. Centrally located. Every guests of us was very happy with the hospitality provided to them,Anil B,26-Feb-18,5
Ramada Jamshedpur,"It was a short buisness trip .Got a great experience of my stay at Ramada ..Specially front office staff are well trained want to Thanks Manmohan in front office who helped me in entire stay .
The food taste good I had a buffet dinner in the jampot restaurant",Rajveer93,25-Feb-18,5
Ramada Jamshedpur,Visited Hotel on business trip.. A warm welcome by Visual and his team.Buffet breakfast was good with full spread. A very knowledgeable Service staff.. A well cultured housekeeping staff. Overall a nice experience in the hotel,rohanbagal,25-Feb-18,5
Ramada Jamshedpur,"The best hotel in in Jamshedpur, very nice property and, the room is equipped with all the amenities for a good stay. Room is spacious enough and the bathroom is also practical and nice. The only issue i had was with the pillows , the pillows were just not right very high and stiff pillows even the replacement pillow was not so comfy. The service is really good with courteous and helpful staff. The dining area is pretty nice with a good breakfast. Would like to appreciate Nikhil the hotel manager for his very helpful nature 
Overall a good stay !!",zahid a,10-Feb-18,4
Ramada Jamshedpur,"Purchased two couple passes for their new year party and it was nothing less than sheer loot. For 6.5 grands a couple, it was quite an exorbitant package and we purchased it assuming it got to be good. However, it was a sheer let down on all counts:
1. We had spoken to the hotel staff before booking and they had mentioned that the new year program involved a Dance troupe and belly dancing by Russian dancers. However, what was finally presented was two foreign dancers on a poorly-designed stage doing some random moves that for sure could not be defined as a ?performance?
2. The arrangement was done in one of their halls (no rooftops or outdoors), stage height was so low that it was impossible for people sitting or standing behind to figure out what was happening on the stage
3. Food was pathetic-bland and tasteless, with only 2 veg and 2 non veg items. Starters were okay though.
4. Drinks on offer at price of the event were below par-if we are paying 6.5 grands, black dog and signature are definitely not worth it-organisers could have gone for a brand of higher standard for sure 
5. This was most shocking-the owner of the property walked in with his entourage and some people in his group started smoking in the family seating area-there was another room for smokers but it seems the owner and his group had no consideration whatsoever for other people in the room
The only saving grace was the DJ who played some foot tapping numbers in general.
All in all, it was a waste of our new year experience, will strongly recommend not to book an event at this property.",VivDelhi,1-Feb-18,1
The Kannelite,I was visiting this Hotel more than a year.Really pleasant and clean rooms.All the staff are incredibly helpful and generous with their time&advice.Responses from your front office team is highly prompt and supportive I would like to appreciate Lead of your front office team Ms. Arunima Bose for her Customer/Client centric approach and her dedication towards Hospitality.Rooms &Room service was good. Food was tasty .I recommend this hotel to my colleagues &known friends...,Ulchi S,26-Mar-18,5
The Kannelite,"I just stay one night for first time my experience it is nice clean hotel with comfortable bed and big room it let me sleep relax nice night wake up listen nice bird sound 
The staff are so nice and fast
I don?t had break fast yet",faith a,7-Feb-18,4
The Kannelite,This place is near to Tata steel plant. good for business purpose. But the rooms are missing the study table for doing official work in the evenings. rooms are spacious. But food in the restaurant (breakfast) is not at all good,PriyaMohan72,3-Oct-17,3
The Kannelite,"Warm people and responsive., good location . Nice and comfortable bed with a decent linen quality . Food taste can be better. All in all a good value for money.

Approach road to the hotel is also good with out any traffic rush with decent parking space.",Samit C,24-May-17,4
The Kannelite,"The restaurant is good in ambience but the service is very poor and slow. I had ordered Chicken Manchow and Chicken Hot n Sour soup . But I was served the same soup for both the orders. You can imagine the quality of food. I had organised an engagement party for one of my relatives last year . But at that time also the food quality was very poor as compared the the exorbitant charges of this hotel .

Hence it is totally your luck what you will get.",abhi_jsr,18-May-17,2
The Kannelite,"Its a very good hotel with all modern amenities... The service is wonderful. The food quality and cost is really an attraction. The cleanliness,staff behavior, welcoming of guests are really appreciable. I would rate them very high",Arindam G,1-Apr-17,5
The Kannelite,"It was nice stay in hotel Kannelite, was there for a day for shoot/work purpose in JSR, clean room, well behaved staff, front desk staff is very good & very professional. over all experience is very good",MukeshSingh_RPF,27-Mar-17,5
The Kannelite,"
The hotel is well decorated and very neatly maintained. This is very new hotel at Jamshedpur. Hotel is situated very near to the market place. The rooms are very clean and comfortable. Food is very good in taste. They have a rooftop restaurant also. Services and behaviour of staffs are very good. The bad is you will get a key card for your room. They can access your room for their routine room service purpose like cleaning your room, changing towels etc in your absence also.",Mayukh C,21-Mar-17,4
Fortune Park Centre Point,Fortune Park Centre Point is well located in Jamshedpur. The best thing about it is its meals which are the best in whole of Jamshedpur. Worth staying there with your family & friends.Don't forget to thank the CHEF for the food.,AnuragKumarGoel,29-Mar-18,5
Fortune Park Centre Point,"Best hygiene standards, courteous staff, amazing hospitality, great food. Strongly recommend this hotel for any one who visit Jamshedpur city.I have stayed here for around 20 days and the entire hotel is run by professional managers with the best team head. This was very evident from the memorable stay, My special thanks to Mr. Anindya Das GM of the hotel and Mr. Zubair too. I had. Looking forward to come back here for yet another joyful experience. Keep it up.Strongly recommend this hotel for any one who visit this steel City. The team - front office, food and beverage, zodiac restaurant team, little Italy roof top restaurant team, house keeping team were all very good, cooperative. Cheers team fortune center point.",azadnaveed88,18-Feb-18,5
Fortune Park Centre Point,"Stayed at the hotel for 2 days, its just average with very basic amenities. i just wished the bed could have been a bit more comfortable . The service is good , the complimentary breakfast is kinda ok with a narrowed down menu. Tthe location of the hotel is good with everything around.",Zahid A,11-Feb-18,3
Fortune Park Centre Point,"I Stayed for 2 days, 1 night- 1st to 2nd February when traveling to XLRI Jamshedpur.
My colleague and I were offered a welcome drink on arrival- Strawberry milkshake.
Checkin was smooth. We checked in at around 12.30pm
At First I checked into the room 304. It was an Executive room, very spacious and roomy layout.
However I Wanted a bathtub hence requested the front desk for a new room.
Was given an Upgrade to Club room, 4th floor
403 however the room ac not working.
I was Shifted to 404. Spacious room with a huge lcd tv, desk, single seated sofa and mini fridge and kettle.
Bed is king size but mattress is really soft and springy, would have liked a firmer one.

Bathroom is really the best part of the room, it?s huge and had a shower enclosure and a bathtub
All essential toiletries- toothpaste and toothbrush, comb, body lotion, body wash, shampoo, bubble bath and soap are provided in the bathroom.

Cons-
**Towels were old and shabby (my colleague mentioned the same about her room too)
**Lunch buffet - around 540 including taxes was a let down.
Mustard fish , chicken stroganoff - 2 dishes in non veg 
Paneer, mixed veg and dal tadka in veg
Noodles, Rice and Rotis
One starter was served to us at the table- chicken tikka.
They also had a salad spread and 1 veg soup 
In desserts - strawberry and mango mousse, warm and delicious chocolate brownies, carrot cake 
Food was decent, nothing special.
Brownie was delicious 

Other details-
The Breakfast buffet is good.
They have a Live dosa and egg station
The rest of the breakfast comprised -Puri aloo peas subji , Idlis, Parathas, Upma, Boiled eggs and Chicken sausages.
In fruits they had - pineapple and papaya diced.
Juice and milk , Corn flakes, Tea and coffee ?? and Toast - white and brown bread 

They have a gym - fitness centre that is functional during fixed timings - 6am to 9am and 5pm to 8pm.

Restaurants-
Neptune is located in the ground floor of the property and little Italy on the rooftop.
Buffet Breakfast is served in Zodiac.

Overall a good stay.",oliviam1710,4-Feb-18,4
Fortune Park Centre Point,The room is one the best I have seen in Tier 2 cities. It is very spacious and chic. The restaurant is a top class standalone restaurant that seems to have many patrons from the locality. The food quality is really topclass. The lift is congested though,Sudevtraveller,13-Nov-17,4
Fortune Park Centre Point,"We stayed for 2 nights and found the hotel to be fantastic. The room was great, . We had room service which was great as well. Location was good . The staff really make this place memorable though. Everyone was extremely helpful and friendly. The breakfast was also fantastic. Mr.Das General Manager of this hotel is very supportive and helpful. Mr. Zubair and his team too, because of such a great people If we came back to Jamshedpur we wouldn?t hesitate to stay here again.",salisiddiqui,7-Nov-17,5
Fortune Park Centre Point,"The location of this hotel provides a good access to many restaurants as well quick access to industrial facilities, we can choose this hotel for a comfortable stay. Size of Room is not up to my expectations when compared to other Fortune hotels",A TripAdvisor Member,1-Nov-17,4
Fortune Park Centre Point,"Location, ambience, rooms, service and food were all wonderful. Prior booking helps get a good room since hotel is full most of the time. Rooms on the south side have less noise. Sonnet hotel is also there in Jamshedpur but this hotel has bigger rooms and the food is the best in this hotel.",rai1324,25-Sep-17,5
Fortune Park Centre Point,"I am a regular visitor to this property and really feel at home, there. Staff is extremely courteous and caring; food, especially continental and Italian is awesome. For the travel - ask them to pack Kati Rolls, you u love them......",Manzir P,25-Sep-17,5
Fortune Park Centre Point,My stay at this hotel was wonderful. Courteous staffs and delucious food. Manager Mr. Danish was very helpful and cooperative to us. Would recommend the travelers to stay at this hotel to experience the world class services. Thnak you team fortune park centre point. You made my stay wonderful.,star t,13-Sep-17,5
The Wave International,"Place is awesome, the mountains view from the room is nice. The room service and housekeeping is fantastic. The Indian recipe are delicious. Ideal place for children, the resort having huge swimming pool, game zone, outdoor gaming and many more.",bunnyrockz,29-Mar-18,5
The Wave International,"Excellent place for family outing, rooms are good. Pool is well mantained. You get a very good view of nature as the hotel is built on the foothills of dalma.
The gaming zone is superb with games for all age group.they have games for group activities as well as individual games.
An awesome experience for me.",Jagdeep B,27-Mar-18,5
The Wave International,"This resort has excellent ambience, food quality have improved, location is awesome. The staff are friendly in nature. Games are available like ATV, a new additions are ther like Fish spa. Recommended visit once with your family for awesome experience.",Dhruvjsr,27-Mar-18,5
The Wave International,Good place to have a quality time the natural beauty is wander full and adventure sports also with it making it a perfect place .Food is not up to the mark . And you must have your own transport .Connectivity in odd hours is problem,bibek113,22-Jan-18,4
The Wave International, I went to this hotel with my family members for dinner but there service is extremely poor and also food. I cant you can get rood side food better than what they serve. So plz ignore this and you can go to many other hotels which provide good service as compared to them,jaskirat s,12-Dec-17,1
The Wave International,"Do not get deceived by the looks of this hotel, I've attended a wedding here and experienced the worst ever service seen anywhere in the world. This hotel is literally being run by bouncers. We were held hostage for 2 days and every day there was power cut for more than 6 hours. You literally have to beg them even for the very basic services like drinking water or hot water because of no electricity.

For weddings they just serve you leftover meals the next day, once you have paid the advance you are in their trap and than your nightmare starts. Hotel staff created ruckus on hotel terrace after consuming alcohol. Save yourself some sanity and keep away from this hotel.",amit m,3-Feb-18,1
Green Park Hotel,"This is one of the worst hotel in the city.The owner/care taker dont know how to talk with customers and have an extremely bad service.Highly pathetic behaviour of the care taker/owner.highly unhygienic room, toilet is worst than a railway platform",siteshjsr,2-Oct-17,1
Green Park Hotel,"If you are looking for connecting trains short business trips this is an ideal hotel to stay, very close to the railway station just 1kms (walkable distance).Their kitchen closes early so make sure to order before hand, staff is very good & helpful.Their rooms are very spacious and well maintained with all necessary amenities(wardrobe,TV,Tables etc.) and bathroom is good.
The only negative being the hotel doesnot have a lift.
It was booked through OYO rooms",santanu7909,3-Jun-16,3
Shanti Nivaas,"*ac room *free breakfast *budget bunk bed concept *new property *friendly staff *clean room and toilet/bathroom we group of 14 stayed their for 5 days what else you need in 500 rs ,,don't think much just go for it",Sweet B,14-Feb-18,5
Hotel Joy,"The rooms were very comfortable and the stay was excellent,front of house staff were very friendly and helpful,I would like to give specially thanks to MR.Nikhil who helped me so much,he is very friendly,every Hotel front office staff should be like him.",akshay b,13-Nov-17,5
Ashoka Inn,Its a good hotel to stay. The range of this hotel is also in budget. The hotel has a very good environment. The staff is also good and co operative. Washrooms and rooms are well maintained and cleaned properly,manmeet singh W,11-Apr-17,3
Hotel L N International,"the hotel is just okay for stay,everything was fine but cant say as very good one.all thing are too simple.food was homely.rate is quite high but safe and secure stay here.you get better home at this rate.",Debapriya p,4-Jan-18,5
Hotel L N International,"Newly established Hotel.All the stay was average.But It was really pathetic while I am talking abt food.Really I cudnt abl to stand it ..The hotel staffs said as newly established hotel it is,we will going to go with best services.The room should be managed bttr the edges of beds badly injured within the stay while roaming here n there within the room.You have to be careful abt that.All othr accommodations were gud though.We asked them to clean the room while we wer out. But they didn't do the same too.We booked this hotel through OYO.May be tourists visit can improve their experience.So we can just help them up by choosing them being as guest to them.Enjoy your stay.",P Niharika M,21-Nov-17,3
10th Milestone,"AS a roadies and love to travel by car ...had chosen this property with its location nearby dalma hills . Unfortunately for those unlucky ppl who couldn't manage their booking in Pindrabera FRH . However the resort gave us more that expected. Booking to be done vide mail and verbal intimation to the manager . A true hill view resort and beautifully located at foothills of Dalma. 

Pros:
1. Location 
2. Sleeping quality 
3. Wonderfully maintained
4. Picturesque lawn for parties 
5. Complimentary breakfast
6. Service 
7. Secure parking
8. Owner behavior
9. Cleanliness 

Cons :
1. Expensive food if some one wish cheaper i\option can walk 15mins to budget dhaba available nearby.
2. Winter weekends will be filled with picnic paries which will debar you to use the lawn and could steal your peace of mind.

Bon Voyage.....",blue_akash,26-Feb-18,5
10th Milestone,"We had a booking at 10th Milestone hotel for 26-28th Jan 2018 from Kolkata. Planned on 21/11/2017 and received confirmation for paying advance (Rs: 2000) on 21/11/2017. 

While asking for further details of our booking on 22/01/2018 , they informed us that they cancelled our booking.

This hotel cancelled our booking without our confirmation. Even they do not bother to inform us by any mail or phone call. They do not provide any apology mail for this while asking for clarification.They also do not bother to refund our advanced money if we did not call on 22/01/2018 for further details. 

The concerned contact person was( Mr. Arup Biswas(Mo:8797598684). The person was totally rude and non-cooperative.

We need to cancel our train booking for this and even we have no option to reschedule any tour for the long weekend(26th-28th Jan 2018) as it was already 22nd Jan 2018( too short time to reschedule).

Even we are facing a lot of harrasment for getting the refund of advanced money. They are delaying the refund with no reason. It is totally frustating.
This service is totally disapponting and disguting. I won't refer anyone to go to 10th Milestone hotel ever.

If anyone has any info how we could get any refund, would be of much help.

Thanks,
Arpita Saha Patra",mamanisaha,24-Jan-18,1
10th Milestone,"The place is well maintained, with green ambience, well mowed lawns, beautiful flowers. But the best stops here only. If you are coming here for good food, you will be disappointed. Pathetic to say the least.Had been to this after a gap of 8 years and the food quality remains same. AWFUL...Stay away if you are looking for good food. Head away to nearby Wave International or City Inn.",ashu_jampot,31-Dec-17,2
The Welcomme Inn,"We stayed there for 2days .I have an examination ovr ter.We booked the room through OYO.Strated with Ola service from the railway station the front desk helped us through finding the place in ease.And they have very cooperative staffs.I saw a hotel with maximum of lady staffs working.Happy to see that actually.Yes,One of the measure issue we found with AC and black and white Tv.Please have your food from Delhi Darbar,walk-able distance if you land on the ground floor of the hotel you can have an eye on Delhi Darbar.The food are amazing in Delhi Darbar and also Chai/Tea is really good ovr here..Yes,about hotel the food is really pathetic and costly.Whatever I tried I feel pathetic why i didnt go to Delhi Darbar.But stay was really comfortable.The location is very comfortable.You can get any autorikshwas any time.The staffs were nice.Enjoy ur stay.",P Niharika M,21-Nov-17,3
Hotel Kailash Regency,"Nice location ,easy to access ,affordable price than other hotels in this area.Total there are 6 floors.Service is nice but sometimes slow also.There are C.CTV Cameras working for security purposes,
Reception is on 1st floor .Each floor there are eight rooms.You can easy get public transport from Tata Nagar Station to this Hotel.",Saurav B,25-Mar-18,3
Hotel Kailash Regency,"An association of many people visited Jamshedpur, Tata for a Satsang. Most of them accomodated in Kailash Residency where the staff showed their pathetic behavior, they were all drunken and beat their customers, very poor service and greedy for money. They dont even have humanity, abused and used bad languages while conversing with the customers, at night they used to drink and also beat a person. Some of the people like Mr Alok Singhania, Harry Singh, Om Prakash, etc had to face this kind of issue. On being beaten by the staff when they tried to call the cops and complain they abused and snatched the phone even.

Apart from that no room service, pathetic smelly rooms and worst food ever.

Don not visit this hotel for your stay, it would be a nightmare for you. Beware of this hotel and specially the staff I think they all are abnormal which made them show this kind of unhuman behavior.

I think they should learn how to behave with people first then they should learn hotel management and people handling skills.",Srishti M,18-Mar-18,1
Hill View Hotel,"Hill view hotel & Resorts is situated on Jamshedpur Ranchi highway around 4kms from Dimna more, 10kms from Tatanagar railway station. A perfect place for weekend if you want to visit Dolma Wildlife Sanctuary, Dimna Lake, Chandil Dam.
Chk in was smooth, rooms were excellent. This resort covers a huge space with greenery. Childrens play area, swimming pool. Food was good, room service was excellent.
Overall a memorable stay",Joy_Saha,23-Jan-18,4
Hill View Hotel,Been to the place on 29/9/17 to 2/10/17. The maintenence is very poor. The website claimes packeged water and tea / Coffee machines in the rooms. There was none and the reception staff explained that website was wrongly designed! And they claimed that these facilities are not available in any resort! These are only for Hotels!. The bevaviour of the staff at the reception desk is rude to say the least. in their best room the fridge does not work. Food is just OK. My suggestion is one should avoid this resort,Goutam C,4-Oct-17,1
Hill View Hotel,"visited the place for family get-together. ambience of the place is ok but the food was yummy, though it took a while for the food to arrive but it was worth the wait.staff is cordial and polite .

visit this place atleast once if you are a foodie",s s,24-Jul-17,4
The Sonnet Jamshedpur,"Very impressed with this place. The service was warm and friendly given by KRISHNA.The food itself was terrific, all of them home runs. The banglai food was delicious at equinox.krishna came over to chat with us to make sure everything was going well, which we appreciated - highly recommended!",santanu12345,1-Apr-18,5
The Sonnet Jamshedpur,"The hotel was excellent.
They provided very good service and the food was also very good.
The entire staff was very co-operative, especially the front office manager, Mr. Ghanshyam and senior executive, Ms. Arpita.
I would definitely visit again.",OmPrakash K,24-Mar-18,5
